{
  "id": "android-dev",
  "name": "Android Developer",
  "version": "0.3.0",
  "description": "Toolchain Android ARM: Gradle, AAPT2, D8/R8, firma y ADB. Shizuku se habilita como backend opcional separado.",
  "packages": [
    "git",
    "openjdk-21",
    "gradle",
    "aapt",
    "aapt2",
    "d8",
    "apksigner",
    "android-tools",
    "ecj",
    "clang",
    "cmake",
    "ninja"
  ],
  "tools": [
    "git.status",
    "git.diff",
    "android.build",
    "android.toolchain",
    "android.apk.badging",
    "android.apk.verify",
    "android.adb.devices",
    "android.adb.connect",
    "android.adb.logcat",
    "android.adb.install",
    "artifact.zip"
  ],
  "permissions": [
    "WORKSPACE_READ",
    "WORKSPACE_WRITE",
    "PROCESS_EXECUTE",
    "NETWORK",
    "PRIVATE_NETWORK",
    "ADB_REMOTE"
  ],
  "runtime": "ANDROID_NATIVE",
  "architectures": [
    "aarch64",
    "arm",
    "x86_64",
    "i686"
  ],
  "upstream": {
    "name": "Termux Android build tools",
    "license": "Apache-2.0",
    "source": "https://github.com/termux/android-build-tools"
  }
}
